{
  "schema_version": "1.0.0",
  "recipe_id": "blorenge-factual-launch",
  "recipe_version": "1.0.0",
  "release_id": "release-blorenge-2026-08-13.5",
  "dataset_version": "2026-08-13.5",
  "registry_id": "blorenge-launch",
  "public_asset_origin": "https://evidence.bca.wales",
  "supersedes": null,
  "inputs": [
    {
      "input_id": "nrw-sssi",
      "dataset_id": "nrw-sssi",
      "source": "registry:acquisition.url",
      "destination": "quarantine/nrw/sssi.geojson",
      "media_type": "application/geo+json",
      "maximum_bytes": 200000,
      "expected_sha256": "5f5651b1cdb747bee3bb60d077391ba3d065854f27f0ab4f11786b48849df8b9"
    },
    {
      "input_id": "nrw-national-park",
      "dataset_id": "nrw-national-park",
      "source": "https://datamap.gov.wales/geoserver/ows?service=WFS&version=2.0.0&request=GetFeature&typeNames=inspire-nrw%3ANRW_NATIONAL_PARK&outputFormat=application%2Fjson&srsName=EPSG%3A27700&BBOX=323291.23,205559.73,330771.19,214952.14,EPSG%3A27700",
      "destination": "quarantine/nrw/national-park.geojson",
      "media_type": "application/geo+json",
      "maximum_bytes": 3000000,
      "expected_sha256": "c577a9ed538e89f1df2ec1334ac1ca98d3163296c3dbb474570fbac02346fe11"
    },
    {
      "input_id": "nrw-main-rivers",
      "dataset_id": "nrw-main-rivers",
      "source": "https://datamap.gov.wales/geoserver/ows?service=WFS&version=2.0.0&request=GetFeature&typeNames=inspire-nrw%3ANRW_MAIN_RIVERS&outputFormat=application%2Fjson&srsName=EPSG%3A27700&BBOX=323291.23,205559.73,330771.19,214952.14,EPSG%3A27700",
      "destination": "quarantine/nrw/main-rivers.geojson",
      "media_type": "application/geo+json",
      "maximum_bytes": 2000000,
      "expected_sha256": "749c79d7338b8c08184169913559b766e1eb5cb0f0a9db10909c2b9ce0b1d0e6"
    },
    {
      "input_id": "nrw-phase1-habitat",
      "dataset_id": "nrw-phase1-vegetation-voronoi",
      "source": "https://datamap.gov.wales/geoserver/ows?service=WFS&version=2.0.0&request=GetFeature&typeNames=geonode%3Anrw_phase1_vegetation_voronoi&outputFormat=application%2Fjson&srsName=EPSG%3A27700&BBOX=323291.23,205559.73,330771.19,214952.14,EPSG%3A27700",
      "destination": "quarantine/nrw/phase1-habitat.geojson",
      "media_type": "application/geo+json",
      "maximum_bytes": 12000000,
      "expected_sha256": "90fe50fbbc941e865c8485d94cb3c95aabeaf8f7abe1c30af8749b408bfbbcc3"
    },
    {
      "input_id": "osm-wales",
      "dataset_id": "osm-wales-geofabrik",
      "source": "registry:acquisition.url",
      "destination": "quarantine/osm/wales-260812.osm.pbf",
      "media_type": "application/vnd.openstreetmap.data+pbf",
      "maximum_bytes": 200000000,
      "expected_sha256": "c98afb597889786c4423eab7d9723bb6d4576d76ef811052a9ef5bd6238446d8"
    },
    {
      "input_id": "lidar-10-323208",
      "dataset_id": "wg-lidar-dtm-2020-2023",
      "source": "https://dmwproductionblob.blob.core.windows.net/lidar-zips/2020-22/dtm/wg_del_10_323208_20210227dtm.tif",
      "destination": "quarantine/lidar/wg_del_10_323208_20210227dtm.tif",
      "media_type": "image/tiff",
      "maximum_bytes": 5000000,
      "expected_sha256": "e89d2a880606398ac5fa858b9d3090b17b6f697ee182918bfc507676ab4479af"
    },
    {
      "input_id": "lidar-10-323209",
      "dataset_id": "wg-lidar-dtm-2020-2023",
      "source": "https://dmwproductionblob.blob.core.windows.net/lidar-zips/2020-22/dtm/wg_del_10_323209_20210227dtm.tif",
      "destination": "quarantine/lidar/wg_del_10_323209_20210227dtm.tif",
      "media_type": "image/tiff",
      "maximum_bytes": 5000000,
      "expected_sha256": "52b899d7d947027b1250da21f767702c7fccd2f6b68870a9fa44ee2b61761709"
    },
    {
      "input_id": "lidar-10-323210",
      "dataset_id": "wg-lidar-dtm-2020-2023",
      "source": "https://dmwproductionblob.blob.core.windows.net/lidar-zips/2020-22/dtm/wg_del_10_323210_20210227dtm.tif",
      "destination": "quarantine/lidar/wg_del_10_323210_20210227dtm.tif",
      "media_type": "image/tiff",
      "maximum_bytes": 5000000,
      "expected_sha256": "6ab0083df155cd91b0f17791f66e09fe2889aeac539030d67cb260fe5527122c"
    },
    {
      "input_id": "lidar-10-324207",
      "dataset_id": "wg-lidar-dtm-2020-2023",
      "source": "https://dmwproductionblob.blob.core.windows.net/lidar-zips/2020-22/dtm/wg_del_10_324207_20210227dtm.tif",
      "destination": "quarantine/lidar/wg_del_10_324207_20210227dtm.tif",
      "media_type": "image/tiff",
      "maximum_bytes": 5000000,
      "expected_sha256": "20e0d216d5ddf9da062f63fba3202d9504e4b78f75862d2ca32a7fb8f28091a4"
    },
    {
      "input_id": "lidar-10-324208",
      "dataset_id": "wg-lidar-dtm-2020-2023",
      "source": "https://dmwproductionblob.blob.core.windows.net/lidar-zips/2020-22/dtm/wg_del_10_324208_20210227dtm.tif",
      "destination": "quarantine/lidar/wg_del_10_324208_20210227dtm.tif",
      "media_type": "image/tiff",
      "maximum_bytes": 5000000,
      "expected_sha256": "032f4448988f4712950086bfad339aa1faf6bc6ef31ab477499bc9074f6ee586"
    },
    {
      "input_id": "lidar-10-324209",
      "dataset_id": "wg-lidar-dtm-2020-2023",
      "source": "https://dmwproductionblob.blob.core.windows.net/lidar-zips/2020-22/dtm/wg_del_10_324209_20210227dtm.tif",
      "destination": "quarantine/lidar/wg_del_10_324209_20210227dtm.tif",
      "media_type": "image/tiff",
      "maximum_bytes": 5000000,
      "expected_sha256": "b01066cb1819969fead5afc26599d90d4c8f5e2bbb56cfc5e76d5e4f8aa4cd3a"
    },
    {
      "input_id": "lidar-10-324210",
      "dataset_id": "wg-lidar-dtm-2020-2023",
      "source": "https://dmwproductionblob.blob.core.windows.net/lidar-zips/2020-22/dtm/wg_del_10_324210_20210227dtm.tif",
      "destination": "quarantine/lidar/wg_del_10_324210_20210227dtm.tif",
      "media_type": "image/tiff",
      "maximum_bytes": 5000000,
      "expected_sha256": "b0e0fb8702e475e612efc3f7926d700683f6aabfa5a5f1268d073f6f47e80df1"
    },
    {
      "input_id": "lidar-10-325206",
      "dataset_id": "wg-lidar-dtm-2020-2023",
      "source": "https://dmwproductionblob.blob.core.windows.net/lidar-zips/2020-22/dtm/wg_del_10_325206_20210227dtm.tif",
      "destination": "quarantine/lidar/wg_del_10_325206_20210227dtm.tif",
      "media_type": "image/tiff",
      "maximum_bytes": 5000000,
      "expected_sha256": "00b7fb620ad91c20c6f914e88a49bfaacb112df6148d86abad17b7961a48dabd"
    },
    {
      "input_id": "lidar-10-325207",
      "dataset_id": "wg-lidar-dtm-2020-2023",
      "source": "https://dmwproductionblob.blob.core.windows.net/lidar-zips/2020-22/dtm/wg_del_10_325207_20210227dtm.tif",
      "destination": "quarantine/lidar/wg_del_10_325207_20210227dtm.tif",
      "media_type": "image/tiff",
      "maximum_bytes": 5000000,
      "expected_sha256": "d66c274546c9b2974ca40a5c4d8d5e509977cb5595e2867bc1f7c69b3392b848"
    },
    {
      "input_id": "lidar-10-325208",
      "dataset_id": "wg-lidar-dtm-2020-2023",
      "source": "https://dmwproductionblob.blob.core.windows.net/lidar-zips/2020-22/dtm/wg_del_10_325208_20210227dtm.tif",
      "destination": "quarantine/lidar/wg_del_10_325208_20210227dtm.tif",
      "media_type": "image/tiff",
      "maximum_bytes": 5000000,
      "expected_sha256": "04a48458cd86f301012df3cd0afe7dc311fabbb9ae19242f232dc4cb40b1dbe2"
    },
    {
      "input_id": "lidar-10-325209",
      "dataset_id": "wg-lidar-dtm-2020-2023",
      "source": "https://dmwproductionblob.blob.core.windows.net/lidar-zips/2020-22/dtm/wg_del_10_325209_20210227dtm.tif",
      "destination": "quarantine/lidar/wg_del_10_325209_20210227dtm.tif",
      "media_type": "image/tiff",
      "maximum_bytes": 5000000,
      "expected_sha256": "5d40cba248f76453be7114fde4efacc5f6241683f1df322c4bbfc568b502867e"
    },
    {
      "input_id": "lidar-10-325210",
      "dataset_id": "wg-lidar-dtm-2020-2023",
      "source": "https://dmwproductionblob.blob.core.windows.net/lidar-zips/2020-22/dtm/wg_del_10_325210_20210227dtm.tif",
      "destination": "quarantine/lidar/wg_del_10_325210_20210227dtm.tif",
      "media_type": "image/tiff",
      "maximum_bytes": 5000000,
      "expected_sha256": "7f8b214285bf494f66b40ef3f8083dc77679fef1f4e1baf6c242e3c487e2dda6"
    },
    {
      "input_id": "lidar-10-326205",
      "dataset_id": "wg-lidar-dtm-2020-2023",
      "source": "https://dmwproductionblob.blob.core.windows.net/lidar-zips/2020-22/dtm/wg_del_10_326205_20210227dtm.tif",
      "destination": "quarantine/lidar/wg_del_10_326205_20210227dtm.tif",
      "media_type": "image/tiff",
      "maximum_bytes": 5000000,
      "expected_sha256": "2ec78a3b0af21538618b26facd13ec684c3ddd49ada88a344bac84b3e60b2ac4"
    },
    {
      "input_id": "lidar-10-326206",
      "dataset_id": "wg-lidar-dtm-2020-2023",
      "source": "https://dmwproductionblob.blob.core.windows.net/lidar-zips/2020-22/dtm/wg_del_10_326206_20210227dtm.tif",
      "destination": "quarantine/lidar/wg_del_10_326206_20210227dtm.tif",
      "media_type": "image/tiff",
      "maximum_bytes": 5000000,
      "expected_sha256": "e45a1215f0dc9525506e3ce0d3b214f9af1d9d11a215a478c32a2c22b71741fb"
    },
    {
      "input_id": "lidar-10-326207",
      "dataset_id": "wg-lidar-dtm-2020-2023",
      "source": "https://dmwproductionblob.blob.core.windows.net/lidar-zips/2020-22/dtm/wg_del_10_326207_20210227dtm.tif",
      "destination": "quarantine/lidar/wg_del_10_326207_20210227dtm.tif",
      "media_type": "image/tiff",
      "maximum_bytes": 5000000,
      "expected_sha256": "5a0b84d93baef2d5c58761358c28baca0ba67ac651d9cd91e68533934ba8bc7e"
    },
    {
      "input_id": "lidar-10-326208",
      "dataset_id": "wg-lidar-dtm-2020-2023",
      "source": "https://dmwproductionblob.blob.core.windows.net/lidar-zips/2020-22/dtm/wg_del_10_326208_20210227dtm.tif",
      "destination": "quarantine/lidar/wg_del_10_326208_20210227dtm.tif",
      "media_type": "image/tiff",
      "maximum_bytes": 5000000,
      "expected_sha256": "a04864fd1f985e5b8173812f2bf756f5e6580d3a481e1080393b022ac6b6e9a0"
    },